{
  "$schema": "https://json-schema.org/draft/2020-12/schema",
  "$id": "https://nimblesite.dev/schemas/shipwright/v1.json",
  "title": "Nimblesite Shipwright product manifest",
  "description": "Authoritative per-product manifest declaring components, bundling, version contracts, and host policies.",
  "type": "object",
  "required": ["manifestVersion", "product", "components"],
  "additionalProperties": false,
  "properties": {
    "manifestVersion": { "type": "integer", "const": 1 },
    "product": {
      "type": "object",
      "required": ["id", "version"],
      "additionalProperties": false,
      "properties": {
        "id": { "type": "string", "pattern": "^[a-z0-9][a-z0-9-]{1,63}$" },
        "displayName": { "type": "string" },
        "version": {
          "type": "string",
          "pattern": "^[0-9]+\\.[0-9]+\\.[0-9]+(?:-[0-9A-Za-z.-]+)?(?:\\+[0-9A-Za-z.-]+)?$"
        },
        "repository": { "type": "string", "format": "uri" },
        "homepage": { "type": "string", "format": "uri" }
      }
    },
    "components": {
      "type": "array",
      "minItems": 1,
      "items": { "$ref": "#/$defs/component" }
    },
    "hosts": {
      "type": "object",
      "additionalProperties": false,
      "properties": {
        "vscode": { "$ref": "#/$defs/hostPolicy" },
        "jetbrains": { "$ref": "#/$defs/hostPolicy" },
        "zed": { "$ref": "#/$defs/hostPolicy" },
        "cli": { "$ref": "#/$defs/hostPolicy" },
        "pkgmgr": { "$ref": "#/$defs/hostPolicy" }
      }
    }
  },
  "$defs": {
    "component": {
      "type": "object",
      "required": ["id", "kind"],
      "additionalProperties": false,
      "properties": {
        "id": { "type": "string", "pattern": "^[a-z0-9][a-z0-9-]{1,63}$" },
        "kind": {
          "type": "string",
          "enum": ["cli", "lsp", "mcp", "sidecar", "dap", "tool", "extension-vscode", "extension-jetbrains", "extension-zed", "asset"]
        },
        "language": {
          "type": "string",
          "enum": ["rust", "dotnet", "dart", "typescript", "kotlin", "javascript"]
        },
        "binaryName": { "type": "string" },
        "expectedVersion": { "type": "string" },
        "platforms": {
          "type": "array",
          "items": {
            "type": "string",
            "enum": ["darwin-arm64", "darwin-x64", "linux-x64", "linux-arm64", "win32-x64", "win32-arm64", "all"]
          }
        },
        "bundled": {
          "type": "object",
          "required": ["bundlePath"],
          "additionalProperties": false,
          "properties": {
            "bundlePath": { "type": "string" },
            "perPlatformArtifact": { "type": "boolean", "default": true }
          }
        },
        "sources": {
          "type": "array",
          "items": {
            "type": "string",
            "enum": ["user-setting", "env", "path", "bundled", "pkgmgr", "dotnet-tool", "npm-global", "cargo-bin", "github-release", "lsp-initialize"]
          },
          "uniqueItems": true
        },
        "userSetting": { "type": "string" },
        "env": {
          "type": "object",
          "additionalProperties": false,
          "properties": {
            "pathVar": { "type": "string" },
            "dirVar": { "type": "string" }
          }
        },
        "pkgmgr": {
          "type": "object",
          "additionalProperties": false,
          "properties": {
            "brew": { "type": "string" },
            "scoop": { "type": "string" },
            "apt": { "type": "string" },
            "winget": { "type": "string" }
          }
        },
        "dotnetTool": {
          "type": "object",
          "required": ["package"],
          "additionalProperties": false,
          "properties": {
            "package": { "type": "string" },
            "command": { "type": "string" }
          }
        },
        "npm": {
          "type": "object",
          "additionalProperties": false,
          "properties": {
            "package": { "type": "string" },
            "bin": { "type": "string" }
          }
        },
        "githubRelease": {
          "type": "object",
          "additionalProperties": false,
          "properties": {
            "repo": { "type": "string", "pattern": "^[^/]+/[^/]+$" },
            "assetPattern": { "type": "string" },
            "checksum": { "type": "boolean", "default": true },
            "cosign": { "type": "boolean", "default": false }
          }
        },
        "verifyStartup": { "type": "boolean", "default": true },
        "versionCheckStrategy": {
          "type": "string",
          "enum": ["version-flag", "version-flag-json", "lsp-initialize"],
          "default": "version-flag"
        },
        "required": { "type": "boolean", "default": true },
        "asset": {
          "type": "object",
          "additionalProperties": false,
          "properties": {
            "source": { "type": "string" },
            "target": { "type": "string" },
            "bundle": { "type": "boolean" },
            "contentHash": { "type": "boolean" },
            "sha256": { "type": "string", "pattern": "^[0-9a-f]{64}$" },
            "downloadOnFirstUse": { "type": "boolean" }
          }
        }
      },
      "allOf": [
        {
          "if": { "properties": { "kind": { "const": "asset" } }, "required": ["kind"] },
          "then": { "required": ["asset"] }
        },
        {
          "if": { "properties": { "kind": { "enum": ["cli", "lsp", "mcp", "sidecar", "dap", "tool"] } }, "required": ["kind"] },
          "then": { "required": ["binaryName", "expectedVersion", "sources"] }
        }
      ]
    },
    "hostPolicy": {
      "type": "object",
      "additionalProperties": false,
      "properties": {
        "artifact": {
          "type": "string",
          "enum": ["vsix-per-platform", "vsix-fat", "intellij-jar", "zed-wasm", "archive", "brew-formula", "scoop-manifest", "nuget", "pub"]
        },
        "activationVerifies": {
          "type": "array",
          "items": { "type": "string" }
        },
        "onMismatch": {
          "type": "string",
          "enum": ["error", "warn", "prompt-reinstall", "prompt-pkgmgr"],
          "default": "error"
        }
      }
    }
  }
}
