{
  "manifestVersion": 1,
  "product": {
    "id": "basilisk",
    "displayName": "Basilisk",
    "version": "0.0.0-PLACEHOLDER",
    "repository": "https://github.com/Nimblesite/Basilisk",
    "homepage": "https://www.basilisk-python.dev"
  },
  "components": [
    {
      "id": "basilisk",
      "kind": "cli",
      "language": "rust",
      "binaryName": "basilisk",
      "expectedVersion": "${PRODUCT_VERSION}",
      "platforms": ["darwin-arm64", "linux-x64", "linux-arm64", "win32-x64", "win32-arm64"],
      "sources": ["path", "pkgmgr", "github-release"],
      "githubRelease": {
        "repo": "Nimblesite/Basilisk",
        "assetPattern": "basilisk-${version}-${platform}.tar.gz",
        "checksum": true
      },
      "verifyStartup": false,
      "versionCheckStrategy": "version-flag",
      "required": true
    }
  ],
  "hosts": {
    "cli": {
      "artifact": "archive",
      "activationVerifies": ["basilisk"],
      "onMismatch": "error"
    },
    "pkgmgr": {
      "artifact": "brew-formula",
      "activationVerifies": ["basilisk"],
      "onMismatch": "error"
    }
  }
}
