{
  "manifestVersion": 1,
  "product": {
    "id": "basilisk",
    "displayName": "Basilisk",
    "version": "0.1.0",
    "repository": "https://github.com/Nimblesite/Basilisk"
  },
  "components": [
    {
      "id": "basilisk",
      "kind": "cli",
      "language": "rust",
      "binaryName": "basilisk",
      "expectedVersion": "${PRODUCT_VERSION}",
      "platforms": ["darwin-arm64", "darwin-x64", "linux-x64", "linux-arm64", "win32-x64"],
      "sources": ["user-setting", "env", "cargo-bin", "github-release", "lsp-initialize"],
      "userSetting": "basilisk.executablePath",
      "env": { "pathVar": "BASILISK_PATH" },
      "githubRelease": {
        "repo": "Nimblesite/Basilisk",
        "assetPattern": "basilisk-${version}-${platform}.tar.gz",
        "checksum": true
      },
      "verifyStartup": true,
      "versionCheckStrategy": "version-flag",
      "required": true
    },
    {
      "id": "basilisk-profiler-helper",
      "kind": "tool",
      "language": "rust",
      "binaryName": "basilisk-profiler-helper",
      "expectedVersion": "${PRODUCT_VERSION}",
      "platforms": ["darwin-arm64", "darwin-x64", "linux-x64", "linux-arm64", "win32-x64"],
      "sources": ["path", "cargo-bin"],
      "verifyStartup": false,
      "versionCheckStrategy": "version-flag",
      "required": false
    },
    {
      "id": "basilisk-zed",
      "kind": "extension-zed",
      "language": "rust",
      "platforms": ["all"]
    }
  ],
  "hosts": {
    "zed": {
      "artifact": "zed-wasm",
      "activationVerifies": ["basilisk"],
      "onMismatch": "error"
    },
    "cli": { "artifact": "archive" },
    "pkgmgr": { "artifact": "brew-formula" }
  }
}
